<?xml version="1.0" encoding="ISO-8859-1"?>
<seminar 
	xmlns:xsi="http://www.w3.org/2001/XMLSchema-instance"
	xsi:noNamespaceSchemaLocation="seminar.xsd">

	<ziel>Einführung in XML</ziel>
	<datum von="2007-04-01" bis="2007-04-03" />
	<zeitplan>
		<lektion von="09:00:00" bis="12:30:00">
			<thema>Überblick</thema>
			<thema>eXtensible Markup Language</thema>
			<thema>Document Type Definition</thema>
		</lektion>
		<pause von="12:30:00" bis="13:30:00">Mittagessen</pause>
		<lektion von="13:30:00" bis="17:00:00">
			<thema>XML Schema</thema>
			<thema>Übungen</thema>
		</lektion>
	</zeitplan>
	<kursleiter>
		<person anrede="Herr">
		    <vorname>Peter</vorname>
    		<nachname>Meier</nachname>
		</person>
	</kursleiter>
	<teilnehmer>
		<person anrede="Herr">
		    <vorname>Eric</vorname>
    		<nachname>Balmer</nachname>
		</person>
		<person anrede="Frau">
		    <vorname>Linda</vorname>
    		<nachname>Mischler</nachname>
		</person>
		<person anrede="Frau">
		    <vorname>Brigitte</vorname>
    		<nachname>Bolli</nachname>
		</person>
		<person anrede="Herr">
		    <vorname>Alban</vorname>
    		<nachname>Fischer</nachname>
		</person>
	</teilnehmer>
</seminar>
